[
  {
    "debugSessionId": "1",
    "flowId": "two-button-and",
    "revision": 7,
    "lifecycleState": "paused",
    "mode": "manual",
    "tickNumber": 1,
    "sampledAtMs": 1000,
    "completedAtMs": 1001,
    "executionDurationUs": 100,
    "inputValidity": [
      "coherent",
      "all_present",
      "all_good"
    ],
    "nodes": [
      {
        "nodeId": "and-main",
        "state": "evaluated",
        "quality": "good",
        "typedValue": {
          "type": "digital",
          "value": false
        }
      },
      {
        "nodeId": "input-01-node",
        "state": "evaluated",
        "quality": "good",
        "typedValue": {
          "type": "digital",
          "value": false
        }
      },
      {
        "nodeId": "input-08-node",
        "state": "evaluated",
        "quality": "good",
        "typedValue": {
          "type": "digital",
          "value": false
        }
      },
      {
        "nodeId": "output-01-node",
        "state": "evaluated",
        "quality": "good",
        "typedValue": {
          "type": "digital",
          "value": false
        }
      }
    ],
    "proposedOutputs": [
      {
        "pointId": "output-01",
        "state": "evaluated",
        "quality": "good",
        "proposedValue": false
      }
    ],
    "overrunCount": 0,
    "evaluationFailureCount": 0,
    "lastReasonCode": 0,
    "lastReason": "ok",
    "lastReasonPath": ""
  },
  {
    "debugSessionId": "1",
    "flowId": "two-button-and",
    "revision": 7,
    "lifecycleState": "paused",
    "mode": "manual",
    "tickNumber": 2,
    "sampledAtMs": 1100,
    "completedAtMs": 1101,
    "executionDurationUs": 100,
    "inputValidity": [
      "coherent",
      "all_present",
      "all_good"
    ],
    "nodes": [
      {
        "nodeId": "and-main",
        "state": "evaluated",
        "quality": "good",
        "typedValue": {
          "type": "digital",
          "value": false
        }
      },
      {
        "nodeId": "input-01-node",
        "state": "evaluated",
        "quality": "good",
        "typedValue": {
          "type": "digital",
          "value": true
        }
      },
      {
        "nodeId": "input-08-node",
        "state": "evaluated",
        "quality": "good",
        "typedValue": {
          "type": "digital",
          "value": false
        }
      },
      {
        "nodeId": "output-01-node",
        "state": "evaluated",
        "quality": "good",
        "typedValue": {
          "type": "digital",
          "value": false
        }
      }
    ],
    "proposedOutputs": [
      {
        "pointId": "output-01",
        "state": "evaluated",
        "quality": "good",
        "proposedValue": false
      }
    ],
    "overrunCount": 0,
    "evaluationFailureCount": 0,
    "lastReasonCode": 0,
    "lastReason": "ok",
    "lastReasonPath": ""
  },
  {
    "debugSessionId": "1",
    "flowId": "two-button-and",
    "revision": 7,
    "lifecycleState": "paused",
    "mode": "manual",
    "tickNumber": 3,
    "sampledAtMs": 1200,
    "completedAtMs": 1201,
    "executionDurationUs": 100,
    "inputValidity": [
      "coherent",
      "all_present",
      "all_good"
    ],
    "nodes": [
      {
        "nodeId": "and-main",
        "state": "evaluated",
        "quality": "good",
        "typedValue": {
          "type": "digital",
          "value": true
        }
      },
      {
        "nodeId": "input-01-node",
        "state": "evaluated",
        "quality": "good",
        "typedValue": {
          "type": "digital",
          "value": true
        }
      },
      {
        "nodeId": "input-08-node",
        "state": "evaluated",
        "quality": "good",
        "typedValue": {
          "type": "digital",
          "value": true
        }
      },
      {
        "nodeId": "output-01-node",
        "state": "evaluated",
        "quality": "good",
        "typedValue": {
          "type": "digital",
          "value": true
        }
      }
    ],
    "proposedOutputs": [
      {
        "pointId": "output-01",
        "state": "evaluated",
        "quality": "good",
        "proposedValue": true
      }
    ],
    "overrunCount": 0,
    "evaluationFailureCount": 0,
    "lastReasonCode": 0,
    "lastReason": "ok",
    "lastReasonPath": ""
  }
]
